<?xml version="1.0" encoding="UTF-8"?>
<project-record xmlns:xsi="http://www.w3.org/2001/XMLSchema-instance"
 xsi:noNamespaceSchemaLocation="file:/C:/Users/franc/Desktop/PLC/PRI/TPC2/project-record.xsd">
    <meta>
        <title>Schema e Stylesheet para tratamento de teses em XML</title>
        <key-name>PED_MICEI2002_TESES</key-name>
        <supervisors>
            <supervisor>
                <name>José Carlos Ramalho</name>
            </supervisor>
        </supervisors>
        <begin-date>Outubro 2020</begin-date>
        <end-date>Outubro 2020</end-date>
    </meta>
    <abstract>
        <p>
        O XML, validado pelo schema, juntamente com o potente processamento via XSLT, permite dispor de facilidades acrescidas no tratamento de informação de uma forma standard e partilhável. Estas são, além de outras evidentes vantagens, as que abrem caminho a uma mais que provável evolução desta tecnologia nos círculos comerciais e de investigação. Outro facto importante, diz respeito à substituição de interfaces EDI por XML em aplicações bussiness oriented.
        
        O trabalho apresentado contempla um schema, uma stylesheet, e a instância do schema em XML. A instância é o próprio relatório.
        
        O trabalho pretende definir uma estrutura expedita e funcional, passível de ser aplicada a um trabalho descritivo, como por exemplo uma tese. Não é objectivo do trabalho criar uma implementação sistemática de todos os objectos possíveis, mas sim criar algumas utilizações mais comuns para exemplificar a potência destas linguagens.
        Ficam neste trabalho em aberto algumas ideias, a serem aplicadas mais tarde a quando da escrita da tese, ou pré-tese, porque na verdade o facto de manter o documento num formato exportável para vários formatos, para várias plataformas, e anotado, garante qualquer tratamento no futuro, constituindo uma vantagem muito importante a ter em conta.
        </p>
    </abstract>
    <workteam>
        <student>
            <ident>80749</ident>
            <name>Francisco Braga Urbano Rosa</name>
            <email>a80749@alunos.uminho.pt</email>
        </student>
    </workteam>
    <deliverables>
        <xref url="file:/C:/Users/franc/Desktop/PLC/PRI/TPC2/project-record.xsd">
        </xref>
        <xref url="file:/C:/Users/franc/Desktop/PLC/PRI/TPC2/project-record1.xml">
        </xref>
        <xref url="file:/C:/Users/franc/Desktop/PLC/PRI/TPC2/project-record.dtd">
        </xref>
    </deliverables>
</project-record>
